{
  "schema_version": "1.0",
  "dh_convention": "standard",
  "source": {
    "name": "ur5_serial.urdf",
    "source_path": "C:\\Users\\abdel\\OneDrive\\Desktop\\URDF2DT\\outputs\\tmp\\stage21-checkout\\robots\\ur5\\ur5_serial.urdf",
    "content_base64": "PD94bWwgdmVyc2lvbj0iMS4wIiBlbmNvZGluZz0idXRmLTgiPz4KPCEtLSBEZXJpdmVkIHNlcmlhbCBmaXh0dXJlOyBzZWUgUkVBRE1FLm1kIGFuZCBMSUNFTlNFLnVwc3RyZWFtIGluIHRoaXMgZGlyZWN0b3J5LiAtLT4KPHJvYm90IG5hbWU9InVyNV9zZXJpYWwiPgogIDxsaW5rIG5hbWU9IndvcmxkIiAvPgogIDxsaW5rIG5hbWU9ImJhc2VfbGluayIgLz4KICA8bGluayBuYW1lPSJzaG91bGRlcl9saW5rIiAvPgogIDxsaW5rIG5hbWU9InVwcGVyX2FybV9saW5rIiAvPgogIDxsaW5rIG5hbWU9ImZvcmVhcm1fbGluayIgLz4KICA8bGluayBuYW1lPSJ3cmlzdF8xX2xpbmsiIC8+CiAgPGxpbmsgbmFtZT0id3Jpc3RfMl9saW5rIiAvPgogIDxsaW5rIG5hbWU9IndyaXN0XzNfbGluayIgLz4KICA8bGluayBuYW1lPSJ0b29sMCIgLz4KICA8am9pbnQgbmFtZT0id29ybGRfam9pbnQiIHR5cGU9ImZpeGVkIj4KICAgIDxwYXJlbnQgbGluaz0id29ybGQiIC8+CiAgICA8Y2hpbGQgbGluaz0iYmFzZV9saW5rIiAvPgogICAgPG9yaWdpbiBycHk9IjAuMCAwLjAgMC4wIiB4eXo9IjAuMCAwLjAgMC4wIiAvPgogIDwvam9pbnQ+CiAgPGpvaW50IG5hbWU9InNob3VsZGVyX3Bhbl9qb2ludCIgdHlwZT0icmV2b2x1dGUiPgogICAgPHBhcmVudCBsaW5rPSJiYXNlX2xpbmsiIC8+CiAgICA8Y2hpbGQgbGluaz0ic2hvdWxkZXJfbGluayIgLz4KICAgIDxvcmlnaW4gcnB5PSIwLjAgMC4wIDAuMCIgeHl6PSIwLjAgMC4wIDAuMDg5MTU5IiAvPgogICAgPGF4aXMgeHl6PSIwIDAgMSIgLz4KICAgIDxsaW1pdCBlZmZvcnQ9IjE1MC4wIiBsb3dlcj0iLTYuMjgzMTg1MzA3MTgiIHVwcGVyPSI2LjI4MzE4NTMwNzE4IiB2ZWxvY2l0eT0iMy4xNSIgLz4KICA8L2pvaW50PgogIDxqb2ludCBuYW1lPSJzaG91bGRlcl9saWZ0X2pvaW50IiB0eXBlPSJyZXZvbHV0ZSI+CiAgICA8cGFyZW50IGxpbms9InNob3VsZGVyX2xpbmsiIC8+CiAgICA8Y2hpbGQgbGluaz0idXBwZXJfYXJtX2xpbmsiIC8+CiAgICA8b3JpZ2luIHJweT0iMC4wIDEuNTcwNzk2MzI2NzkgMC4wIiB4eXo9IjAuMCAwLjEzNTg1IDAuMCIgLz4KICAgIDxheGlzIHh5ej0iMCAxIDAiIC8+CiAgICA8bGltaXQgZWZmb3J0PSIxNTAuMCIgbG93ZXI9Ii02LjI4MzE4NTMwNzE4IiB1cHBlcj0iNi4yODMxODUzMDcxOCIgdmVsb2NpdHk9IjMuMTUiIC8+CiAgPC9qb2ludD4KICA8am9pbnQgbmFtZT0iZWxib3dfam9pbnQiIHR5cGU9InJldm9sdXRlIj4KICAgIDxwYXJlbnQgbGluaz0idXBwZXJfYXJtX2xpbmsiIC8+CiAgICA8Y2hpbGQgbGluaz0iZm9yZWFybV9saW5rIiAvPgogICAgPG9yaWdpbiBycHk9IjAuMCAwLjAgMC4wIiB4eXo9IjAuMCAtMC4xMTk3IDAuNDI1IiAvPgogICAgPGF4aXMgeHl6PSIwIDEgMCIgLz4KICAgIDxsaW1pdCBlZmZvcnQ9IjE1MC4wIiBsb3dlcj0iLTMuMTQxNTkyNjUzNTkiIHVwcGVyPSIzLjE0MTU5MjY1MzU5IiB2ZWxvY2l0eT0iMy4xNSIgLz4KICA8L2pvaW50PgogIDxqb2ludCBuYW1lPSJ3cmlzdF8xX2pvaW50IiB0eXBlPSJyZXZvbHV0ZSI+CiAgICA8cGFyZW50IGxpbms9ImZvcmVhcm1fbGluayIgLz4KICAgIDxjaGlsZCBsaW5rPSJ3cmlzdF8xX2xpbmsiIC8+CiAgICA8b3JpZ2luIHJweT0iMC4wIDEuNTcwNzk2MzI2NzkgMC4wIiB4eXo9IjAuMCAwLjAgMC4zOTIyNSIgLz4KICAgIDxheGlzIHh5ej0iMCAxIDAiIC8+CiAgICA8bGltaXQgZWZmb3J0PSIyOC4wIiBsb3dlcj0iLTYuMjgzMTg1MzA3MTgiIHVwcGVyPSI2LjI4MzE4NTMwNzE4IiB2ZWxvY2l0eT0iMy4yIiAvPgogIDwvam9pbnQ+CiAgPGpvaW50IG5hbWU9IndyaXN0XzJfam9pbnQiIHR5cGU9InJldm9sdXRlIj4KICAgIDxwYXJlbnQgbGluaz0id3Jpc3RfMV9saW5rIiAvPgogICAgPGNoaWxkIGxpbms9IndyaXN0XzJfbGluayIgLz4KICAgIDxvcmlnaW4gcnB5PSIwLjAgMC4wIDAuMCIgeHl6PSIwLjAgMC4wOTMgMC4wIiAvPgogICAgPGF4aXMgeHl6PSIwIDAgMSIgLz4KICAgIDxsaW1pdCBlZmZvcnQ9IjI4LjAiIGxvd2VyPSItNi4yODMxODUzMDcxOCIgdXBwZXI9IjYuMjgzMTg1MzA3MTgiIHZlbG9jaXR5PSIzLjIiIC8+CiAgPC9qb2ludD4KICA8am9pbnQgbmFtZT0id3Jpc3RfM19qb2ludCIgdHlwZT0icmV2b2x1dGUiPgogICAgPHBhcmVudCBsaW5rPSJ3cmlzdF8yX2xpbmsiIC8+CiAgICA8Y2hpbGQgbGluaz0id3Jpc3RfM19saW5rIiAvPgogICAgPG9yaWdpbiBycHk9IjAuMCAwLjAgMC4wIiB4eXo9IjAuMCAwLjAgMC4wOTQ2NSIgLz4KICAgIDxheGlzIHh5ej0iMCAxIDAiIC8+CiAgICA8bGltaXQgZWZmb3J0PSIyOC4wIiBsb3dlcj0iLTYuMjgzMTg1MzA3MTgiIHVwcGVyPSI2LjI4MzE4NTMwNzE4IiB2ZWxvY2l0eT0iMy4yIiAvPgogIDwvam9pbnQ+CiAgPGpvaW50IG5hbWU9IndyaXN0XzNfbGluay10b29sMF9maXhlZF9qb2ludCIgdHlwZT0iZml4ZWQiPgogICAgPG9yaWdpbiBycHk9Ii0xLjU3MDc5NjMyNjc5IDAgMCIgeHl6PSIwIDAuMDgyMyAwIiAvPgogICAgPHBhcmVudCBsaW5rPSJ3cmlzdF8zX2xpbmsiIC8+CiAgICA8Y2hpbGQgbGluaz0idG9vbDAiIC8+CiAgPC9qb2ludD4KPC9yb2JvdD4K"
  },
  "configuration": {
    "geometry": {
      "parallel_threshold": 1e-05,
      "intersection_threshold": 1e-06,
      "common_normal_threshold": 1e-06
    },
    "validation": {
      "position_tolerance_m": 0.0001,
      "orientation_tolerance_rad": 0.0001,
      "samples": 50,
      "random_seed": 42
    },
    "ui": {
      "live_preview": true
    },
    "logging": {
      "level": "INFO"
    },
    "reference_status": "provisional",
    "reference_note": "Plan section 10; advisor/report reconciliation pending."
  },
  "state": {
    "automatic_model": {
      "robot_name": "ur5_serial",
      "rows": [
        {
          "a": 0.0,
          "alpha": 1.5707963267948966,
          "d": 0.089159,
          "theta_offset": 0.0,
          "joint_name": "shoulder_pan_joint",
          "joint_type": "revolute",
          "joint_sign": 1
        },
        {
          "a": -0.425,
          "alpha": 0.0,
          "d": 0.0,
          "theta_offset": -4.89657334287251e-12,
          "joint_name": "shoulder_lift_joint",
          "joint_type": "revolute",
          "joint_sign": 1
        },
        {
          "a": -0.39225000000000004,
          "alpha": 0.0,
          "d": 0.0,
          "theta_offset": -1.2591102048850322e-17,
          "joint_name": "elbow_joint",
          "joint_type": "revolute",
          "joint_sign": 1
        },
        {
          "a": 0.0,
          "alpha": 1.5707963267948966,
          "d": 0.10915,
          "theta_offset": -4.896591786318936e-12,
          "joint_name": "wrist_1_joint",
          "joint_type": "revolute",
          "joint_sign": 1
        },
        {
          "a": -9.32033763861495e-19,
          "alpha": -1.5707963267948966,
          "d": 0.09465,
          "theta_offset": 0.0,
          "joint_name": "wrist_2_joint",
          "joint_type": "revolute",
          "joint_sign": 1
        },
        {
          "a": 0.0,
          "alpha": 0.0,
          "d": 0.08230000000000001,
          "theta_offset": 0.0,
          "joint_name": "wrist_3_joint",
          "joint_type": "revolute",
          "joint_sign": 1
        }
      ],
      "provenance": "StandardDHSolver v1: common-normal construction from URDF zero-pose axes; parallel rejection threshold=1e-05; references=provisional. Numeric model; not a global-validation certificate.",
      "source_urdf": "C:\\Users\\abdel\\OneDrive\\Desktop\\URDF2DT\\outputs\\tmp\\stage21-checkout\\robots\\ur5\\ur5_serial.urdf",
      "is_temporary_fixture": false,
      "base_transform": [
        [
          -1.0,
          0.0,
          0.0,
          0.0
        ],
        [
          0.0,
          -1.0,
          0.0,
          0.0
        ],
        [
          0.0,
          0.0,
          1.0,
          0.0
        ],
        [
          0.0,
          0.0,
          0.0,
          1.0
        ]
      ],
      "tool_transform": [
        [
          1.0,
          0.0,
          0.0,
          3.954443108431834e-17
        ],
        [
          0.0,
          1.0,
          -4.8965888601467475e-12,
          1.2723702198930902e-19
        ],
        [
          0.0,
          4.8965888601467475e-12,
          1.0,
          0.0
        ],
        [
          0.0,
          0.0,
          0.0,
          1.0
        ]
      ],
      "source_sha256": "2dc91dafb13f23beadb867f81880db1de4baa963973e768521ab7abbc5314882"
    },
    "working_model": {
      "robot_name": "ur5_serial",
      "rows": [
        {
          "a": 0.0,
          "alpha": 1.5707963267948966,
          "d": 0.089159,
          "theta_offset": 0.0,
          "joint_name": "shoulder_pan_joint",
          "joint_type": "revolute",
          "joint_sign": 1
        },
        {
          "a": -0.425,
          "alpha": 0.0,
          "d": 0.025,
          "theta_offset": -4.89657334287251e-12,
          "joint_name": "shoulder_lift_joint",
          "joint_type": "revolute",
          "joint_sign": 1
        },
        {
          "a": -0.39225000000000004,
          "alpha": 0.0,
          "d": -0.025,
          "theta_offset": -1.2591102048850322e-17,
          "joint_name": "elbow_joint",
          "joint_type": "revolute",
          "joint_sign": 1
        },
        {
          "a": 0.0,
          "alpha": 1.5707963267948966,
          "d": 0.10915,
          "theta_offset": -4.896591786318936e-12,
          "joint_name": "wrist_1_joint",
          "joint_type": "revolute",
          "joint_sign": 1
        },
        {
          "a": -9.32033763861495e-19,
          "alpha": -1.5707963267948966,
          "d": 0.09465,
          "theta_offset": 0.0,
          "joint_name": "wrist_2_joint",
          "joint_type": "revolute",
          "joint_sign": 1
        },
        {
          "a": 0.0,
          "alpha": 0.0,
          "d": 0.08230000000000001,
          "theta_offset": 0.0,
          "joint_name": "wrist_3_joint",
          "joint_type": "revolute",
          "joint_sign": 1
        }
      ],
      "provenance": "StandardDHSolver v1: common-normal construction from URDF zero-pose axes; parallel rejection threshold=1e-05; references=provisional. Numeric model; not a global-validation certificate.",
      "source_urdf": "C:\\Users\\abdel\\OneDrive\\Desktop\\URDF2DT\\outputs\\tmp\\stage21-checkout\\robots\\ur5\\ur5_serial.urdf",
      "is_temporary_fixture": false,
      "base_transform": [
        [
          -1.0,
          0.0,
          0.0,
          0.0
        ],
        [
          0.0,
          -1.0,
          0.0,
          0.0
        ],
        [
          0.0,
          0.0,
          1.0,
          0.0
        ],
        [
          0.0,
          0.0,
          0.0,
          1.0
        ]
      ],
      "tool_transform": [
        [
          1.0,
          0.0,
          0.0,
          3.954443108431834e-17
        ],
        [
          0.0,
          1.0,
          -4.8965888601467475e-12,
          1.2723702198930902e-19
        ],
        [
          0.0,
          4.8965888601467475e-12,
          1.0,
          0.0
        ],
        [
          0.0,
          0.0,
          0.0,
          1.0
        ]
      ],
      "source_sha256": "2dc91dafb13f23beadb867f81880db1de4baa963973e768521ab7abbc5314882"
    },
    "frames": [
      "accepted",
      "accepted",